{
  "schema_version": "1.0.0",
  "timestamp": "2026-04-15T10:30:00Z",
  "summary": {
    "total_rules": 8,
    "passed": 6,
    "failed": 1,
    "warned": 1,
    "skipped": 0,
    "total_violations": 8,
    "excepted_violations": 7,
    "stale_exceptions": 1
  },
  "dimensions": {
    "MT01": {
      "name": "Maintainability",
      "runtime_status": "evaluated",
      "promotion_status": "active",
      "enforcement": "enforced",
      "score": 0.92,
      "rules_evaluated": 3,
      "rules_passed": 3,
      "rules_failed": 0,
      "rules_warned": 0,
      "rules_downgraded": 0,
      "total_violations": 2,
      "excepted_violations": 2
    },
    "MD01": {
      "name": "Modularity & Coupling",
      "runtime_status": "evaluated",
      "promotion_status": "active",
      "enforcement": "enforced",
      "score": 0.88,
      "rules_evaluated": 2,
      "rules_passed": 1,
      "rules_failed": 0,
      "rules_warned": 1,
      "rules_downgraded": 0,
      "total_violations": 1,
      "excepted_violations": 0
    },
    "ST01": {
      "name": "Structural Integrity",
      "runtime_status": "evaluated",
      "promotion_status": "active",
      "enforcement": "enforced",
      "score": 1.0,
      "rules_evaluated": 0,
      "rules_passed": 0,
      "rules_failed": 0,
      "rules_warned": 0,
      "rules_downgraded": 0,
      "total_violations": 0,
      "excepted_violations": 0
    },
    "SC01": {
      "name": "Security",
      "runtime_status": "evaluated",
      "promotion_status": "active",
      "enforcement": "enforced",
      "score": 1.0,
      "rules_evaluated": 0,
      "rules_passed": 0,
      "rules_failed": 0,
      "rules_warned": 0,
      "rules_downgraded": 0,
      "total_violations": 0,
      "excepted_violations": 0
    },
    "LG01": {
      "name": "Legality",
      "runtime_status": "evaluated",
      "promotion_status": "active",
      "enforcement": "enforced",
      "score": 1.0,
      "rules_evaluated": 0,
      "rules_passed": 0,
      "rules_failed": 0,
      "rules_warned": 0,
      "rules_downgraded": 0,
      "total_violations": 0,
      "excepted_violations": 0
    },
    "AC01": {
      "name": "Accessibility",
      "runtime_status": "evaluated",
      "promotion_status": "active",
      "enforcement": "enforced",
      "score": 1.0,
      "rules_evaluated": 0,
      "rules_passed": 0,
      "rules_failed": 0,
      "rules_warned": 0,
      "rules_downgraded": 0,
      "total_violations": 0,
      "excepted_violations": 0
    },
    "PF01": {
      "name": "Performance",
      "runtime_status": "evaluated",
      "promotion_status": "incubating",
      "enforcement": "advisory",
      "score": 1.0,
      "rules_evaluated": 0,
      "rules_passed": 0,
      "rules_failed": 0,
      "rules_warned": 0,
      "rules_downgraded": 0,
      "total_violations": 0,
      "excepted_violations": 0
    },
    "AV01": {
      "name": "Availability",
      "runtime_status": "evaluated",
      "promotion_status": "incubating",
      "enforcement": "advisory",
      "score": 1.0,
      "rules_evaluated": 0,
      "rules_passed": 0,
      "rules_failed": 0,
      "rules_warned": 0,
      "rules_downgraded": 0,
      "total_violations": 0,
      "excepted_violations": 0
    }
  },
  "system_fitness": {
    "score": 0.95,
    "min_score": 0.7,
    "passing": true,
    "weights_used": {
      "MT01": 0.25,
      "MD01": 0.25,
      "ST01": 0.15,
      "SC01": 0.15,
      "LG01": 0.10,
      "AC01": 0.10
    },
    "weights_note": "All six active dimensions contributed; no redistribution needed",
    "trend": {
      "previous_score": 0.78,
      "delta": 0.035,
      "direction": "improving",
      "dimension_deltas": {
        "MT01": 0.03,
        "MD01": -0.02,
        "ST01": 0.00,
        "SC01": 0.05,
        "LG01": 0.00,
        "AC01": 0.10
      }
    }
  },
  "results": [
    {
      "rule_id": "max-efferent-coupling",
      "rule_name": "Maximum Efferent Coupling",
      "dimension": "MD01",
      "status": "warn",
      "violations": [
        {
          "entity": "src/core",
          "field": "efferent_coupling",
          "actual": 24,
          "threshold": 20,
          "direction": "max",
          "excepted": false
        }
      ],
      "exceptions_used": 0,
      "total_entities": 36
    }
  ],
  "stale_exceptions": [
    {
      "rule_id": "max-fan-out",
      "entity": "packages.old-module",
      "reason": "entity_not_found"
    }
  ]
}
